{
  "schema": "raf.ecosystem-runtime-state.v1",
  "observed_at": "2026-08-12T04:35:17Z",
  "ci_execution": {
    "state": "BLOCKED_INFRA",
    "reason": "GitHub Actions check 94011180319 for PR #342/head fb09c9cc0b68455711e20bb047abb19c68628b07 was not started: GitHub annotation states that recent account payments failed or the spending limit needs to be increased. Job evidence: steps=[], runner_id=0, runner_name=''. Therefore no Kotlin/Gradle test/build step executed; this is infrastructure/billing evidence, not FAIL_CODE and not PASS."
  },
  "components": [
    {
      "id": "rafgittools.android-client",
      "repository": "rafaelmeloreisnovo/RafGitTools",
      "path": "app/",
      "implementation_state": "PARTIAL",
      "evidence_state": "DECLARED_BY_AUTHOR",
      "evidence": [
        "Kotlin/Compose/Hilt/Room sources are integrated",
        "GitHub API and JGit implementations are present",
        "authentication source paths and unit-test sources are present",
        "P33 backlog records 33/33 features as source-functional on the interactive-staging integration branch"
      ],
      "gaps": [
        "GitHub Actions cannot currently execute because the account billing/spending gate prevents runner allocation",
        "No devDebug APK + SHA-256 is recorded for the current reviewed head",
        "No explicit physical-device install/start smoke receipt is recorded for the current reviewed head"
      ],
      "next_action": "Use scripts/rafgittools_readiness_gate.sh with an already configured JDK17/Android SDK; then explicitly enable RAFGITTOOLS_DEVICE_SMOKE=1 only when a device and APK are available. Hosted Actions require the account billing/spending gate to be resolved before they can provide execution evidence.",
      "commit": "37f6121ade1b34579267efc8282d27bd2c3d772b"
    },
    {
      "id": "rafgittools.auth",
      "repository": "rafaelmeloreisnovo/RafGitTools",
      "path": "app/src/main/kotlin/com/rafgittools/data/auth/",
      "implementation_state": "IMPLEMENTED",
      "evidence_state": "DECLARED_BY_AUTHOR",
      "evidence": [
        "PAT authentication source path is present",
        "OAuth Device Flow source path is present with placeholder rejection",
        "gh CLI token import source path is present and validates process exit/hostname",
        "secure auth repository source path is present",
        "GitHub HTTPS UI and JGit transport map token material to password rather than username"
      ],
      "gaps": [
        "OAuth Device Flow requires a real public GitHub OAuth Client ID at build/runtime configuration",
        "Authenticated app-level device smoke remains TOKEN_VAZIO"
      ],
      "next_action": "Use PAT as the primary bootstrap path; configure a real OAuth Client ID separately and prove the selected login path on device without logging credential material.",
      "commit": "37f6121ade1b34579267efc8282d27bd2c3d772b"
    },
    {
      "id": "rafgittools.private-auth-check",
      "repository": "rafaelmeloreisnovo/RafGitTools",
      "path": "scripts/rafgittools_private_auth_check.sh",
      "implementation_state": "IMPLEMENTED",
      "evidence_state": "DECLARED_BY_AUTHOR",
      "evidence": [
        "Script verifies gh authentication and private repository metadata access",
        "Script does not call gh auth token and does not persist Authorization material",
        "Local receipt is hashed and ignored by Git by default"
      ],
      "gaps": [
        "Execution result on the user's Termux installation remains TOKEN_VAZIO until the script is run there"
      ],
      "next_action": "Run scripts/rafgittools_private_auth_check.sh in authenticated Termux and preserve the local receipt hash.",
      "commit": "789dd3e79994a2073e129820ed3b51b2e15c63be"
    },
    {
      "id": "rafgittools.readiness-gate",
      "repository": "rafaelmeloreisnovo/RafGitTools",
      "path": "scripts/rafgittools_readiness_gate.sh",
      "implementation_state": "IMPLEMENTED",
      "evidence_state": "DECLARED_BY_AUTHOR",
      "evidence": [
        "Local gate separates PASS, FAIL, TOKEN_VAZIO and SKIP",
        "Gate checks source anchors, runtime truth, auth surface, Termux host, JDK17, Android SDK, unit tests, APK build/hash and device presence",
        "Physical install/start smoke is explicit opt-in and never runs by surprise",
        "Receipts are local, timestamped and SHA-256 hashed when sha256sum is available"
      ],
      "gaps": [
        "Gate execution on the target Termux/device remains TOKEN_VAZIO",
        "Full VERIFIED_DEVICE requires APK build/hash and explicit device smoke in one evidence chain"
      ],
      "next_action": "Execute the local gate from the reviewed checkout; while hosted Actions are billing-blocked, its receipt is the canonical executable evidence source.",
      "commit": "789dd3e79994a2073e129820ed3b51b2e15c63be"
    },
    {
      "id": "rafgittools.interactive-staging",
      "repository": "rafaelmeloreisnovo/RafGitTools",
      "path": "app/src/main/kotlin/com/rafgittools/data/git/InteractiveStagingService.kt",
      "implementation_state": "IMPLEMENTED",
      "evidence_state": "DECLARED_BY_AUTHOR",
      "evidence": [
        "Per-hunk stage and unstage source paths exist",
        "Mutation is index-only and never rewrites the working tree",
        "Selected hunk, HEAD and index object are revalidated before mutation",
        "DirCache is locked and DirCacheEditor commit is used for publication",
        "DirCache unlock is unconditional in finally and safe after successful commit because JGit unlock is idempotent",
        "Working-tree bytes are compared bit-identically during stage",
        "Binary/non-UTF8/missing-final-newline/unmerged inputs fail closed",
        "DiffViewer exposes explicit Stage hunk / Unstage hunk controls",
        "Source tests cover selective stage, selective unstage, stale rejection, missing-final-newline rejection and cancellation"
      ],
      "gaps": [
        "Gradle/Kotlin execution of the current head is not observed because GitHub Actions did not allocate a runner",
        "Physical Android interactive-staging smoke remains TOKEN_VAZIO"
      ],
      "next_action": "Run local readiness/unit-test gate, then exercise two-hunk stage/unstage on the Android build and preserve receipt/hash evidence."
    },
    {
      "id": "rafgittools.offline-queue",
      "repository": "rafaelmeloreisnovo/RafGitTools",
      "path": "app/src/main/kotlin/com/rafgittools/offline/",
      "implementation_state": "IMPLEMENTED",
      "evidence_state": "DECLARED_BY_AUTHOR",
      "evidence": [
        "OfflineQueue has a durable storage boundary",
        "AtomicFileQueueStorage uses bounded records, fsync and same-directory publication",
        "Repository sync worker and Room-backed state are present in the current source tree"
      ],
      "gaps": [
        "Production scheduling and recovery still require physical-device regression evidence"
      ],
      "next_action": "Exercise enqueue/restart/recovery and WorkManager behavior on device and record a receipt before promoting runtime evidence.",
      "commit": "37f6121ade1b34579267efc8282d27bd2c3d772b"
    },
    {
      "id": "rafgittools.terminal-bounded-executor",
      "repository": "rafaelmeloreisnovo/RafGitTools",
      "path": "app/src/main/kotlin/com/rafgittools/terminal/TerminalEmulator.kt",
      "implementation_state": "IMPLEMENTED",
      "evidence_state": "DECLARED_BY_AUTHOR",
      "evidence": [
        "Output is drained concurrently to prevent pipe deadlock",
        "Unclosed quotes and incomplete escapes are rejected",
        "Git commands are restricted to read-only subcommands",
        "Writable operations remain outside the generic terminal surface"
      ],
      "gaps": [
        "This is intentionally a bounded executor, not PTY/VT100"
      ],
      "next_action": "Keep writable operations routed through typed/governed actions rather than widening the generic command allowlist.",
      "commit": "37f6121ade1b34579267efc8282d27bd2c3d772b"
    },
    {
      "id": "rafgittools.multi-provider",
      "repository": "rafaelmeloreisnovo/RafGitTools",
      "path": "app/src/main/kotlin/com/rafgittools/platform/MultiPlatformManager.kt",
      "implementation_state": "IMPLEMENTED",
      "evidence_state": "DECLARED_BY_AUTHOR",
      "evidence": [
        "GitLab v4 adapter is implemented",
        "Bitbucket v2 adapter is implemented",
        "Gitea/Forgejo v1 adapter is implemented",
        "Azure DevOps REST adapter is implemented",
        "Typed Success/NotConfigured/AuthenticationError/NetworkError states are present"
      ],
      "gaps": [
        "Provider credentials and real remote regressions are not recorded in the current evidence chain"
      ],
      "next_action": "Validate each provider independently with disposable credentials/repositories; never collapse untested remote behavior into PASS.",
      "commit": "37f6121ade1b34579267efc8282d27bd2c3d772b"
    },
    {
      "id": "rafgittools.advanced-external-runtime",
      "repository": "rafaelmeloreisnovo/RafGitTools",
      "path": "app/src/main/",
      "implementation_state": "PARTIAL",
      "evidence_state": "TOKEN_VAZIO",
      "evidence": [
        "Adapters/UI exist for GPG, Git LFS, worktree and bisect",
        "LLaMA JNI bridge source exists but requires external llama headers/runtime"
      ],
      "gaps": [
        "GPG runtime fixture not executed",
        "Git LFS remote fixture not executed",
        "Worktree filesystem/device matrix not executed",
        "Bisect controlled regression fixture not executed",
        "LLaMA external dependency/runtime not pinned and proven in this evidence chain"
      ],
      "next_action": "Treat these as P2 non-blocking capabilities and close each TOKEN_VAZIO with its own isolated fixture/evidence chain after core Git/GitHub runtime is verified.",